<?xml version="1.0" encoding="UTF-8"?>
<FTL xmlns:xsi="http://www.w3.org/2001/XMLSchema-instance" xsi:noNamespaceSchemaLocation="../../../schema/autoBlueprints.xsd">
  <blueprintList name="SHIPS_PAVONIAN">
    <name>PAVONIAN_ASSAULT</name>
    <name>PAVONIAN_FIGHTER</name>
    <name>PAVONIAN_GUARD</name>
    <name>PAVONIAN_SCOUT</name>
  </blueprintList>

  <!--TODO add 2 generic ships (6) -->

  <shipBlueprintEnemy name="PAVONIAN_ASSAULT" img="pavonian_assault" layout="pavonian_assault">
    <class>Pavonian Assault</class>
    <systemList>
      <pilot power="1" max="3" room="0"/>
      <engines power="1" max="4" room="7"/>
      <weapons room="4"/>
      <oxygen power="1" max="3" room="6"/>
      <shields power="2" max="8" room="9"/>
      <doors power="1" max="3" room="1" start="false"/>
    </systemList>
    <sector id="4">
      <weaponList missiles="1" system_power="6">
        <weapon name="WEAPONS_MISSILES_2"/>
        <weapon name="WEAPONS_CHAIN_3"/>
        <weapon name="WEAPONS_LASER_1"/>
        <weapon name="WEAPONS_LASER_2"/>
      </weaponList>
    </sector>
    <sector id="5">
      <weaponList missiles="1" system_power="7">
        <weapon name="WEAPONS_MISSILES_2"/>
        <weapon name="WEAPONS_CHAIN_3"/>
        <weapon name="WEAPONS_LASER_2"/>
        <weapon name="WEAPONS_LASER_2"/>
      </weaponList>
    </sector>
    <sector id="6">
      <weaponList missiles="1" system_power="8">
        <weapon name="WEAPONS_MISSILES_2"/>
        <weapon name="WEAPONS_CHAIN_3"/>
        <weapon name="WEAPONS_LASER_3"/>
        <weapon name="WEAPONS_LASER_2"/>
      </weaponList>
    </sector>
    <sector id="7">
      <weaponList missiles="2" system_power="8">
        <weapon name="WEAPONS_MISSILES_2"/>
        <weapon name="WEAPONS_CHAIN_3"/>
        <weapon name="WEAPONS_LASER_3"/>
        <weapon name="WEAPONS_LASER_2"/>
      </weaponList>
    </sector>
    <health amount="10"/>
    <crewCount amount="4" max="5" class="pavonian"/>
    <boardingAI>sabotage</boardingAI>
    <aug name="SYSTEM_CASING"/>
    <cloakImage>pavonian_assault</cloakImage>
  </shipBlueprintEnemy>

  <shipBlueprintEnemy name="PAVONIAN_FIGHTER" img="pavonian_fighter" layout="pavonian_fighter">
    <class>Pavonian Fighter</class>
    <systemList>
      <pilot power="1" max="3" room="0"/>
      <engines power="1" max="5" room="6"/>
      <weapons room="1"/>
      <oxygen power="1" max="3" room="7"/>
      <shields power="2" max="8" room="5"/>
      <doors power="1" max="3" room="8" start="false"/>
    </systemList>
    <sector id="1">
      <weaponList missiles="0" system_power="4">
        <weapon name="WEAPONS_CHAIN_2"/>
        <weapon name="WEAPONS_LASER_2"/>
      </weaponList>
    </sector>
    <sector id="2">
      <weaponList missiles="0" system_power="4">
        <weapon name="WEAPONS_CHAIN_2"/>
        <weapon name="WEAPONS_LASER_2"/>
      </weaponList>
    </sector>
    <sector id="3">
      <weaponList missiles="0" system_power="5">
        <weapon name="WEAPONS_CHAIN_2"/>
        <weapon name="WEAPONS_CHAIN_2"/>
        <weapon name="WEAPONS_LASER_1"/>
      </weaponList>
    </sector>
    <sector id="4">
      <weaponList missiles="0" system_power="6">
        <weapon name="WEAPONS_CHAIN_2"/>
        <weapon name="WEAPONS_CHAIN_2"/>
        <weapon name="WEAPONS_LASER_2"/>
      </weaponList>
    </sector>
    <health amount="8"/>
    <crewCount amount="3" max="4" class="pavonian"/>
    <boardingAI>sabotage</boardingAI>
    <aug name="SYSTEM_CASING"/>
    <cloakImage>pavonian_fighter</cloakImage>
  </shipBlueprintEnemy>

  <shipBlueprintEnemy name="PAVONIAN_GUARD" img="pavonian_guard" layout="pavonian_guard">
    <class>Pavonian Guard</class>
    <systemList>
      <pilot power="1" max="3" room="0"/>
      <engines power="1" max="5" room="6"/>
      <weapons room="5"/>
      <oxygen power="1" max="3" room="7"/>
      <shields power="2" max="8" room="4"/>
      <doors power="1" max="3" room="1" start="false"/>
    </systemList>
    <sector id="3">
      <weaponList missiles="1" system_power="5">
        <weapon name="WEAPONS_MISSILES_2"/>
        <weapon name="WEAPONS_CHAIN_2"/>
        <weapon name="WEAPONS_CORE_1"/>
        <weapon name="WEAPONS_CORE_2"/>
      </weaponList>
    </sector>
    <sector id="4">
      <weaponList missiles="1" system_power="6">
        <weapon name="WEAPONS_MISSILES_2"/>
        <weapon name="WEAPONS_CHAIN_3"/>
        <weapon name="WEAPONS_CORE_1"/>
        <weapon name="WEAPONS_CORE_2"/>
      </weaponList>
    </sector>
    <sector id="5">
      <weaponList missiles="1" system_power="7">
        <weapon name="WEAPONS_MISSILES_2"/>
        <weapon name="WEAPONS_CHAIN_3"/>
        <weapon name="WEAPONS_CORE_2"/>
        <weapon name="WEAPONS_CORE_2"/>
      </weaponList>
    </sector>
    <sector id="6">
      <weaponList missiles="1" system_power="8">
        <weapon name="WEAPONS_MISSILES_2"/>
        <weapon name="WEAPONS_CHAIN_3"/>
        <weapon name="WEAPONS_CORE_3"/>
        <weapon name="WEAPONS_CORE_2"/>
      </weaponList>
    </sector>
    <health amount="10"/>
    <crewCount amount="3" max="5" class="pavonian"/>
    <boardingAI>sabotage</boardingAI>
    <aug name="SYSTEM_CASING"/>
    <cloakImage>pavonian_guard</cloakImage>
  </shipBlueprintEnemy>

  <shipBlueprintEnemy name="PAVONIAN_SCOUT" img="pavonian_scout" layout="pavonian_scout">
    <class>Pavonian Scout</class>
    <systemList>
      <pilot power="1" max="3" room="0"/>
      <engines power="1" max="4" room="1"/>
      <weapons room="2"/>
      <oxygen power="1" max="3" room="4"/>
      <shields power="2" max="6" room="5"/>
    </systemList>
    <sector id="0">
      <weaponList missiles="0" system_power="3">
        <weapon name="WEAPONS_CHAIN_2"/>
        <weapon name="WEAPONS_LASER_1"/>
      </weaponList>
    </sector>
    <sector id="1">
      <weaponList missiles="0" system_power="4">
        <weapon name="WEAPONS_CHAIN_2"/>
        <weapon name="WEAPONS_LASER_2"/>
      </weaponList>
    </sector>
    <sector id="2">
      <weaponList missiles="0" system_power="4">
        <weapon name="WEAPONS_CHAIN_2"/>
        <weapon name="WEAPONS_LASER_2"/>
      </weaponList>
    </sector>
    <sector id="3">
      <weaponList missiles="0" system_power="5">
        <weapon name="WEAPONS_CHAIN_2"/>
        <weapon name="WEAPONS_LASER_3"/>
      </weaponList>
    </sector>
    <health amount="7"/>
    <crewCount amount="2" max="3" class="pavonian"/>
    <boardingAI>sabotage</boardingAI>
    <aug name="SYSTEM_CASING"/>
    <cloakImage>pavonian_scout</cloakImage>
  </shipBlueprintEnemy>
</FTL>